{
  "render_time": "2026-07-03T03:03:15.975881+00:00",
  "duration_seconds": 127.47,
  "input_assets": {
    "images": [
      "assets/images/img_0001.jpg",
      "assets/images/img_0002.jpg",
      "assets/images/img_0003.jpg",
      "assets/images/img_0004.jpg",
      "assets/images/img_0005.jpg",
      "assets/images/img_0006.jpg",
      "assets/images/img_0007.jpg",
      "assets/images/img_0008.jpg",
      "assets/images/img_0009.jpg",
      "assets/images/img_0010.jpg",
      "assets/images/img_0011.jpg",
      "assets/images/img_0012.jpg",
      "assets/images/img_0013.jpg",
      "assets/images/img_0014.jpg",
      "assets/images/img_0015.jpg",
      "assets/images/img_0031.jpg"
    ],
    "voiceover": [
      "assets/voice/voice_scene0001_seg0000.wav",
      "assets/voice/voice_scene0001_seg0001.wav",
      "assets/voice/voice_scene0002_seg0000.wav",
      "assets/voice/voice_scene0003_seg0000.wav",
      "assets/voice/voice_scene0003_seg0001.wav",
      "assets/voice/voice_scene0004_seg0000.wav",
      "assets/voice/voice_scene0004_seg0001.wav",
      "assets/voice/voice_scene0005_seg0000.wav",
      "assets/voice/voice_scene0005_seg0001.wav",
      "assets/voice/voice_scene0005_seg0002.wav",
      "assets/voice/voice_scene0006_seg0000.wav",
      "assets/voice/voice_scene0006_seg0001.wav",
      "assets/voice/voice_scene0006_seg0002.wav",
      "assets/voice/voice_scene0007_seg0000.wav",
      "assets/voice/voice_scene0007_seg0001.wav",
      "assets/voice/voice_scene0008_seg0000.wav",
      "assets/voice/voice_scene0008_seg0001.wav",
      "assets/voice/voice_scene0009_seg0000.wav",
      "assets/voice/voice_scene0009_seg0001.wav",
      "assets/voice/voice_scene0010_seg0000.wav",
      "assets/voice/voice_scene0010_seg0001.wav",
      "assets/voice/voice_scene0011_seg0000.wav",
      "assets/voice/voice_scene0011_seg0001.wav",
      "assets/voice/voice_scene0012_seg0000.wav",
      "assets/voice/voice_scene0012_seg0001.wav",
      "assets/voice/voice_scene0013_seg0000.wav",
      "assets/voice/voice_scene0013_seg0001.wav",
      "assets/voice/voice_scene0013_seg0002.wav",
      "assets/voice/voice_scene0015_seg0000.wav",
      "assets/voice/voice_scene0015_seg0001.wav",
      "assets/voice/voice_scene0015_seg0002.wav",
      "assets/voice/voice_scene0015_seg0003.wav",
      "assets/voice/voice_scene0031_seg0000.wav",
      "assets/voice/voice_scene0031_seg0001.wav",
      "assets/voice/voice_scene0031_seg0002.wav"
    ]
  },
  "output_size_bytes": 17528030,
  "output_path": "render/final_video.mp4",
  "errors": [],
  "scene_count": 16,
  "succeeded_scenes": 16,
  "failed_scenes": 0
}
